89:52,5391.99,8.13,foul a sends up to the line that you see LeBron goes down hard fortunately he's up walking to the bench the big thing on
90:00,5400.12,7.14,that injury is Cleveland had to take their last timeout so if they have
90:07,5407.26,8.03,trouble getting the ball in if Golden State scores it's going you cannot have any more timeouts
90:15,5415.29,7.89,so James will go to the free-throw line a hard fall he's 7 of 8 from the line
90:23,5423.18,5.16,holding on and punching that right fist
90:29,5429.08,5.31,I can't say enough about the job Kevin Love did on that last possession defenses against the two-time MVP
90:34,5434.39,6.21,encouraged [Applause]
90:41,5440.60,4.28,Warriors have two timeouts remaining
90:49,5448.64,6.91,stays a three-point game to Mike as a player there's no pressure right now
90:56,5455.55,5.40,you're up three worst-case scenario you got to give them one free throw that should be the mindset I missed it you
91:01,5460.95,6.51,got to step up and knock this free throw down in your LeBron James Warriors will no doubt cold timeout miss or make here
91:07,5467.46,7.95,from James rattles in the second four-point game
91:15,5475.41,6.04,timeout Golden State Cleveland does have
91:21,5481.45,10.74,a foul to give LeBron James now with 27 points 11 rebounds and 11 assists some
91:32,5492.19,6.63,huge plays of the fourth quarter for Cleveland including this one they came out at a timeout set to get Steph Curry
91:39,5498.82,6.12,on Kyrie Irving they get exactly what they want everybody out of my way it's time to dance get some one-on-one lulls
91:45,5504.94,6.57,in the sleep horses the late contest that's a big-time offensive play by Kyrie Irving but it's a play he's made
91:52,5511.51,6.17,his entire life the ability to score and flat out get it done on the offensive end
91:58,5517.68,6.58,Irving now with 26 and back in Cleveland these fans realized their ten point six
92:04,5524.26,6.81,seconds away now from a championship and I'm not sure I like Shumpert on curry in
92:11,5531.07,8.22,this situation do you use your foul right here I would say yes I'd be on the
92:19,5539.29,5.79,top side I would make them go to their second play and you can't forget about
92:25,5545.08,6.27,mo Speights either a great point and I totally agree I take the foul on this possession forcing them to take it out
92:31,5551.35,5.34,again curry runs off big Adama looking
92:37,5556.69,6.69,Thompson catches Thompson a couple of dribbles head fake tied up throws it into green and a foul on the entry pass
92:43,5563.38,5.07,that's the foul to give and now they'll take it out of bounds with 6.5 remaining
92:48,5568.45,6.24,and you got to make sure you're in nobody's area to allow them to knock down to three and you get contact
92:55,5574.69,6.06,I lost a playoff game on a phantom four-point play to Jeff Van Gundy make
93:01,5580.75,5.64,$1 to inbound Shumpert trying to stay with curry catches one dribble steps
93:06,5586.39,6.86,back puts up a three won't go rebound tips taken by Speights final seconds it's over it's over
93:13,5593.25,7.34,Cleveland is a city of Champions once again the Cavaliers are NBA champions
93:35,5614.58,9.81,Cleveland's long sports nightmare has ended the drought is over 52 years time
93:44,5624.39,6.30,to celebrate a title and the emotions
93:51,5630.69,6.99,for LeBron James who delivers on his promise to come home and bring a championship to his beloved
93:58,5637.68,7.05,hometown [Applause]
94:05,5645.34,6.54,[Music] [Applause]
94:19,5658.89,5.96,and of course the disappointment the stunning disappointment at the other end
94:25,5664.85,8.71,James Jones his longtime teammate and with him for all six of these consecutive finals and an emotional
94:34,5673.56,8.48,Tehran Lou [Applause]
94:47,5687.33,7.39,water see an emotional scene for LeBron James these diehard fans so passionate
94:55,5694.72,7.20,they so love their team's decades of heartbreak of being teased but had never diminished their passion and now they're
95:02,5701.92,10.74,rewarded with an NBA championship as always the terrific sportsmanship so
95:13,5712.66,7.85,much more to come here from Oracle Arena as LeBron James and the Cavaliers win the NBA championship
95:23,5723.01,6.90,a shocking ending for Steph Curry in the
95:30,5729.91,6.27,Golden State Warriors to lose their last two games at Oracle Arena the most dominant home port in the NBA over the
95:36,5736.18,7.38,past two years as they failed to repeat coming up short in game 7 against the
95:44,5743.56,8.04,Cleveland Cavaliers LeBron James came back home to deliver a championship to
95:52,5751.60,6.57,his hometown he fulfilled his promise tonight with a spectacular road
95:58,5758.17,5.67,performance in the fourth quarter to win the championship let's get the ceremonies going right now and go to PA
96:04,5763.84,5.55,announcer Matt Horwitz ladies and
96:09,5769.39,5.01,gentlemen please direct your attention to center court for the presentation of
96:14,5774.40,5.85,the Larry O'Brien trophy and the 2016 Bill Russell NBA Finals Most Valuable
96:20,5780.25,7.92,Player Award please welcome ABC's odorous Berg with
96:28,5788.17,5.58,us tonight to present the 2016 NBA championship trophy please welcome NBA
96:34,5793.75,7.49,Commissioner Adam Silver you just witnessed one of the greatest
96:41,5801.24,7.89,games in NBA history to the Golden State Warriors congratulations on a historic
96:49,5809.13,7.11,season the Joel ACO Peter Guber and coach Kerr you're all a class act
96:56,5816.24,5.94,and the NBA thanks you and now Dan
97:02,5822.18,5.76,Gilbert your partner's your family coach Lou and
97:08,5827.94,5.52,the tremendous Cleveland Cavaliers congratulations you're the first team in
97:13,5833.46,7.13,the history of the NBA to come back from the 3-1 deficit to win the championship
97:21,5840.59,7.18,and to Northeast Ohio and Cleveland the curse is over the 52 year drought has
97:28,5847.77,4.94,come to an end let me present the championship trophy
97:39,5859.13,12.76,[Applause]
97:53,5872.97,17.61,dan Gilbert we have shots all night down
98:11,5890.58,6.73,of your fans back in Cleveland you said you felt an obligation to bring the
98:17,5897.31,7.11,title to those hungry fans why people of Cleveland deserves as Morton any people
98:24,5904.42,5.76,I've ever seen a mat or felt and thank God that God loves Cleveland Ohio he
98:30,5910.18,7.56,does I want to thank everybody think David Griffin on the front office tie in the coaching staff Oh everybody the
98:38,5917.74,5.91,entire franchise the best fans in the world and LeBron James and the Cleveland
98:44,5923.65,9.75,Cavaliers LeBron the first time could
98:53,5933.40,6.75,you have ever envisioned in returning and fulfilling the street I couldn't hear he exactly Doris but I all I know
99:00,5940.15,7.08,is no group deserves this more no fanbase deserves us more and I'm speechless and proud of everybody it's
99:07,5947.23,7.58,like a fantasy everybody Thank You Cleveland love you Cleveland thank you to the Golden State Warriors enjoy Lake
99:15,5954.81,5.52,your plants that was a great series great series congratulations
99:20,5960.33,5.80,tyloo today there was a point in wish
99:26,5966.13,5.34,you were down three to one but your confidence never faltered what
99:31,5971.47,7.50,was it about the character of this group that you never doubted them just we've been through adversity all year and you
99:39,5978.97,6.33,know we went through a lot and you know guys counted us out you know they said we couldn't get it done but I miss it
99:45,5985.30,5.16,ain't about me it's about the guys you know they you know I would believe all these guys any night any day and they
99:50,5990.46,5.49,stuck with it and we had a chance to give up we've been made history tonight and I told you sighs you know all year
99:56,5995.95,5.97,we've been making history by not tonight so these guys came out had a great showing I'll go to war and bow these
100:02,6001.92,5.73,guys in a single night and I want to give a shout out to Mexico Missouri and Cleveland Ohio we're coming back baby
100:08,6007.65,6.18,let's go [Applause]
100:14,6013.83,7.44,you have played along some of the old-time greats Shaq Kobe Michael we are witnesses one
100:21,6021.27,6.63,about once-in-a-generation players and LeBron James what makes this man so extraordinarily special you know outside
100:28,6027.90,5.79,of his basketball talent that's what you look at when you see on the floor you see his basketball talent the way
100:34,6033.69,5.64,control of the game can take over a game and things like that but the biggest things for LeBron the reason why he
100:39,6039.33,6.33,deserves this is because he has a great heart and he's always given he's given to everyone and it's not just about
100:46,6045.66,6.15,basketball it's about who he is as a person and great things happen to great people so I was happy for LeBron I'm
100:52,6051.81,5.70,happy for the city of Cleveland the state of Ohio the Cleveland Cavaliers organization and Mexico Missouri we in
100:58,6057.51,7.74,the house baby time now to bring back NBA Commissioner Adam Silver to present
101:05,6065.25,7.20,the MVP award Adam two years ago he
101:12,6072.45,6.48,wrote a letter to his fans in which he said I'm coming home and he said nothing
101:19,6078.93,6.60,is given to you in Northeast Ohio everything is earned in LeBron it was
101:26,6085.53,7.82,unanimous most valuable player 2016 NBA Finals congratulations
101:34,6094.34,16.26,[Applause]
101:51,6110.60,6.19,LeBron in that letter that Adams silver reference you said the most important thing to you was to bring the
101:57,6116.79,7.98,championship to Northeast Ohio why was that so important I understood with the people of
102:05,6124.77,6.81,Northeast Ohio been through the last 50 plus years I kept it I kept it at bay I
102:12,6131.58,5.73,never stressed the fact that I didn't feel the pressure that none of those things so it always kept me level-headed
102:17,6137.31,5.46,but I understood what everyone in Northeast Ohio been through the last 50 plus years and I'm happy to be a part of
102:23,6142.77,5.78,history I can't wait to get back home I'm ready to get to you guys
102:30,6149.51,5.34,what kind of character that it require of a group that not so many playing in
102:35,6154.85,5.28,their first NBA Finals to come out and win on this floor we've been through so
102:40,6160.13,6.18,much adversity these last two years I just knew we was capable of even being
102:46,6166.31,7.50,down 3-1 verse the greatest regular-season team ever you know 73 and 9 and everybody counted
102:54,6173.81,5.10,us out and that's when we strived the most when everybody count us out and that's definitely when I strived it most
102:59,6178.91,6.72,when everybody count me out you won two titles in Miami and I know they meant the world to you why does this one feel
103:06,6185.63,5.25,different I'm home I'm home this is what
103:11,6190.88,5.40,I came back for I'm at a loss for words
103:16,6196.28,7.13,this is unbelievable it doesn't feel real right now Thank You Doris thank you so much
103:29,6209.21,6.94,firing a year ago you were alone in a hospital room watching your team do
103:36,6216.15,5.79,battle and try to win an NBA championship can you describe what it was like for you going to battle and
103:42,6221.94,8.28,ultimately fulfilling what were childhood dreams you said history was made tonight but I mean that that
103:50,6230.22,6.54,championship team that's in that locker room right there we got to give him a lot of credit they did an amazing job and for us it was just about being
103:57,6236.76,7.11,resilient and coming in and taking care of business but I mean this was is one for the books literally it's one for the books down
104:04,6243.87,6.15,the stretch the big three was able to
104:10,6250.02,6.26,deliver why was that just an aggressive staying and sticking to the game plan executing offensively and defensively
104:16,6256.28,6.79,but I'm glad all the X's and O's are done and we can celebrate this championship can you describe what it is
104:23,6263.07,5.34,like long side of LeBron James and what effect he has on this group's ability to
104:28,6268.41,5.25,be confident that it can win regardless of the circumstance best player on the planet right there as you can see with
104:34,6273.66,7.83,the Finals MVP he took us home tonight and that's what he does that's what great players do and he made his 39 I'm
104:41,6281.49,7.29,proud of him congratulations Tristan Thompson I don't
104:49,6288.78,7.47,know many guys Tristan that would embrace so readily the dirty work that you pursue on a nightly basis why why
104:56,6296.25,5.01,are you so able to embrace that role he's starring a role I'd like to look at
105:01,6301.26,5.82,it's a great shift team at the puzzle everyone's has you know the role some guys always ask or defend and for me
105:07,6307.08,6.45,just do the dirty work and just be starring a role you told us yesterday that your father is responsible for the
105:14,6313.53,7.23,toughness that you display at his father's day and you'd be here but I know he's watching what would you say to him thank you for
105:21,6320.76,6.81,everything just the toughness the workout the key he's good in our family I love you pops
105:28,6327.57,10.58,I would put the same question to you you are playing makes this man so great
105:38,6338.15,5.74,Michael Jackson say he's a bad bad man Doris just just how he's able to elevate
105:44,6343.89,5.10,one's game and and just help us young guys show us what it takes to win a twin and win a championship
105:49,6348.99,6.83,congratulations Tristan and congratulations to the 2016 NBA champion
105:57,6356.53,7.04,[Applause] unless you've lived it in that city it's
106:04,6363.57,6.09,difficult to understand the magnitude of the moment for those sports fans the overwhelming joy the depth of the
106:10,6369.66,6.00,emotion the Cleveland sports fans celebrating right now and guys you know
106:16,6375.66,8.94,you've been a part of the sleep for a long time all that goes into a moment like this all the decisions not just for
106:25,6384.60,7.38,LeBron to come to Cleveland but also management front office coaches these
106:32,6391.98,6.18,players carrier moves spectacular it's it's everybody's championship even the
106:38,6398.16,8.01,fans of Cleveland that have gone through so much waiting for this moment they deserve it absolutely everyone knows the Irving
106:46,6406.17,7.35,jump shot of how great he played and James but listen Kevin Love played big tonight Shumpert made that four-point
106:54,6413.52,5.62,play I mean everybody has a part and everybody should be recognized
106:59,6419.14,6.72,and mark fans are always a part of it I don't know I mean there's been certain instances but these fans such a part of
107:06,6425.86,6.24,this they've been teased and tormented years where their teams had no chance other years seasons of great halt only
107:12,6432.10,8.96,to end in heartbreak and now they have their title their championship and courtesy of one of their own
107:22,6442.14,8.25,[Music] and as LeBron James cradling the NBA
107:30,6450.39,3.23,championship trophy