00:01,1.19,7.18,welcome to Oakland California for Game seven of the 2016 NBA Finals where the
00:08,8.37,5.92,Golden State Warriors had a comfortable 3-1 series lead two straight losses at their repeat
00:14,14.29,6.27,hopes in some jeopardy meanwhile in Cleveland the Cavalier fans have hope
00:21,20.56,5.84,again that this could be the year that the title drought comes to an end
00:26,26.40,7.86,LeBron James and the Cavs with victories in games five and six to even this series at seven names of peace can they
00:34,34.26,5.91,pull off the victory here tonight meanwhile Golden State struggling the last couple of games
00:40,40.17,7.47,but they're back on their home floor where they're so tough to beat over the last couple of sessions arena is alive
00:48,47.64,5.42,and roaring as we get set for Game seven there's the starting lineups and the
00:53,53.06,5.50,change Festus is healing Andrew Bogut out with a knee injury Andre Iguodala will come
00:59,58.56,5.13,off the bench Burroughs Ely his first start of the entire postseason he
01:04,63.69,9.20,started 13 games during the regular season he has been a terrific backup Center tonight the starting role
01:13,73.32,7.08,these finals had to add a little bit of everything some great team plays unbelievable individual performances
01:20,80.40,6.78,suspensions and ejection off court drama the one thing we haven't had yet is a close game let's see if that happens
01:27,87.18,5.55,tonight JR Smith misses does Hill he can't control it but curry tips to the
01:33,92.73,6.33,bones and Mike right away we see draymond Green starting defense Lee against LeBron James trying to make sure
01:39,99.06,6.00,they keep him outside in the paint area and force him to be a jump shooter Green
01:45,105.06,6.36,was not pleased with his performance in Game six said he was too tentative vasily can't get at the ball and James
01:51,111.42,7.83,the rebound guys you both have been a part of game sevens you've both been a part of the finals but butterflies in
01:59,119.25,6.57,the nerves have to be unbelievable as Thompson goes inside and lays it in how do you get it to settle down but you
02:06,125.82,6.30,got to continue to remind yourself that is just another game sure the intensity show of the moment sure the sense of
02:12,132.12,5.43,urgency but don't get out of character the same things that put you into position will put you in position to be
02:18,137.55,7.29,a champ klay Thompson drives rain fakes bring up to a ceiling who misses from
02:25,144.84,6.06,point-blank range James comes out of the pack fakes drives on Barnes left-handed
02:31,150.90,10.49,banks it in and as Ely said to quality looks to start the game which starts have been
02:41,161.39,5.28,critical recently as Curry's way off the mark Thompson gets the rebound for the
02:47,166.67,5.16,Cleveland Cavaliers what they did the start Game six was unreal one of the
02:52,171.83,6.99,more dominant first quarters you'll ever see in a playoff game as breed throws it down on a beautiful feed from the
02:59,178.82,6.72,ceiling and a good job little split action in the lack of communication from Thompson and James allowed draymond
03:06,185.54,8.03,Green to Brooklyn to the cup Kevin Love looking to post-up play Thompson on him
03:14,193.57,7.65,shot clock at 6 love double team finds junior Smith launches at three-pointer
03:21,201.40,5.65,love's got to catch that deeper or he's inviting the double teams green again to
03:27,207.05,5.13,a ceiling and he's fouled on the entry passes Tristan Thompson will pick up his
03:32,212.18,5.31,first [Applause] Tristan Thompson says he didn't call
03:37,217.49,5.49,switch this is a big to big pic as far as Thompson and James good job by the
03:43,222.98,5.36,Warriors creating that confusion and a great pass from Azealia Barnes
03:48,228.34,5.71,boy must that feel good Barnes in the last two games 2 for 22
03:54,234.05,6.81,and he had missed his last 14 shots from the field inexcusably and inexplicably
04:01,240.86,6.72,they were not matched up on the side out of bounds James on the pull-up bounces
04:08,247.58,8.34,off hurry the rebound this place is deafening already bring up
04:16,255.92,4.70,top again Barnes Green for three
04:33,272.61,6.74,Irving on the drive pulls up shot bounces off the rim is hilly falls it in
04:40,280.49,5.65,Thompson for three morning adrenaline must be flowing right
04:46,286.14,7.71,now a pretty quick pace to start James guarded by Steph Curry with swinging in
04:54,293.85,8.31,the ball love can't hit rebound Tristan Thompson can't hold on warriors ball love the energy in this
05:02,302.16,6.33,building this crowd is as good as it gets we said the other night may have been
05:08,308.49,7.50,the lattice we heard Quicken Loans Arena this might be the loudest we've heard this building but on that drive James
05:16,315.99,6.68,versus courage don't drive to pass drive to score Seeley blocked by Thompson
05:23,322.67,9.04,terrific defensive play from Tristan Thompson who has been marvelous this series Kevin Love goes it is healing
05:32,331.71,7.95,misses love's tip won't go love takes it away from Mazzilli excellent second
05:40,339.66,5.28,effort from Kevin Love it's been a difficult series for love
05:45,344.94,6.33,had the concussion missed again came off the bench game on the return from the
05:51,351.27,3.38,concussion as Barnes drives
05:57,357.47,5.76,James goes that draymond Green bad pass intended for Thompson and the first
06:03,363.23,6.78,turnover of the game the coach talked about it as well a bran James got to put his head down and attack go look to
06:10,370.01,6.78,finish as opposed to going in looking to kick out make a play but Green did an outstanding job of leveling him off and
06:17,376.79,10.13,making it him go away from the basket topsis lazuli tips it the right to James
06:30,389.81,5.19,the cavalier offense the last couple of games have been so efficient as Kyrie
06:35,395.00,7.44,Irving nails that one in last two games they shot over 50% from the field that
06:42,402.44,6.33,that included Game five here in the victory at Oracle Arena and a timeout
06:49,408.77,6.42,called and this is good defense from klay Thompson did a great job by Steph Curry showing and getting back Thompson
06:55,415.19,6.95,does his job keeping them in front active hands contest that's just great offense by Kyrie Irving a spectacular
07:02,422.14,7.99,offensive weapons continue to have his way [Music]
07:16,435.95,5.56,the Gazala last year's finals MVP will guard LeBron James most of the Wayne's
07:22,441.51,5.37,when he's out there curry four to shoot finds a little room fires
07:27,446.88,2.78,hits a three
07:34,454.38,10.12,and you see for the first time Steve Carr gets his Ely out and he goes with that infamous small lineup they are
07:45,464.50,5.88,spitting Mazzilli gave them some good minutes to start the game as James goes
07:50,470.38,6.87,inside kicks it out to Irvin little fate two-point jumper that won't go rebound love haven't lost it and it's still
07:57,477.25,7.11,gonna be Cavs ball his dream on dream touch the glass I really like Kevin love's aggressiveness on the offensive board
08:04,484.36,6.75,that's what he's a lead at do what you're best at Green goes out to guard
08:11,491.11,9.06,junior Smith Smith drives to the basket layup is good he's mixed it up nicely
08:20,500.17,6.17,between his three-point shooting and some drives to the basket all five starters have scores for Cleveland
08:26,506.34,6.25,Lawrence tries again that's good basketball Mike that's very good
08:33,512.59,6.57,basketball good point making pull the Warriors those are shots that Steve Kerr will live with Barnes has been in a huge
08:39,519.16,5.94,struggle that's why the first three so important seat curtailing just go out rebound and defend everything will take
08:45,525.10,8.22,care of itself shot clock at six high and the second turnover by LeBron James who has really
08:53,533.32,6.87,kept his turnovers down and as you talked about at the top mark what he's done the past two games not just the 41
09:00,540.19,5.85,points but the overall play 82 points 24 rebounds and 18 assists in back-to-back
09:06,546.04,6.03,elimination games unbelievable numbers that last possession you could see the adjustment that the war is made sure
09:12,552.07,5.25,Curry gets on the Bron James but the double-team is coming quick ball touched
09:17,557.32,7.01,out of bounds along the baseline first turnover for Golden State as we listen to a Steve Kerr huddle
09:25,564.98,6.30,we just did a little bit of a rush which it's game seven we're all pumped up and everything no problem right but get the
09:31,571.28,6.57,Momo in the first few possessions we got it moving we got great stuff okay last couple we've taken some quick shot
09:38,577.85,7.17,keep it moving last two games they've shot just 36%
09:45,585.02,5.28,from the field and 40% it's the best offensive team in the NBA all season but
09:50,590.30,5.04,the Cavs have been superb defensively James taken away by draymond Green
09:55,595.34,6.95,[Applause]
10:02,602.29,5.08,Thompson the height advantage on Irving Jefferson goes to help Thompson able
10:07,607.37,2.42,attack
10:17,616.68,6.40,[Applause] Thompson guarding Irving down the other end he's been guarding all-star players
10:23,623.08,5.40,throughout these playoffs James fires away a three-pointer too strong draymond
10:28,628.48,5.07,Green grabs another curry got sloppy
10:34,633.55,6.89,with a dribble and Jefferson picks up the Aaron Paul James to Jefferson Jefferson goes right at draymond Green
10:40,640.44,7.00,how great has he been this series for a guy who was committed to Dallas and then
10:47,647.44,7.02,Dallas led him out of that commitment when James decided to go back to Cleveland just so impactful in this
10:54,654.46,6.75,series curry leans in can't hit rebound James again jr. Smith releases and lays
11:01,661.21,6.36,it in beautiful pass and Smith with the easy bucket and those are the shots that you cannot give up you're the Warriors
11:08,667.57,5.37,long shot but you must give back poor job getting back in transition
11:13,672.94,5.39,I thought curry got nudged from behind by junior Smith klay Thompson for three
11:18,678.33,5.62,that's their fourth three-pointer already four of nine from downtown and
11:24,683.95,6.54,Mike that's the action that gave him so many problems klay Thompson when he comes up he's never setting the screen
11:30,690.49,6.07,he slipped out it gives the switch problem gets the wide open look
11:37,696.56,5.41,[Applause] Marie helps out Smith pass right through
11:42,701.97,6.54,the hands of Perry James but two-handed slam Curie had that steel but it slipped
11:49,708.51,14.70,through his hands and LeBron James takes advantage Harrison Barnes not hesitant
12:03,723.21,9.51,at all too strong and Barnes is 1 for 4 James felt some contact missed the shot
12:13,732.72,7.38,picked up by curry Mary coming off his first career ejection in game 6 as
12:20,740.10,6.27,Barnes good look just can't get it to fall and he struggles with those a good
12:26,746.37,5.70,look those are quality trips on the offensive end if you're Harrison Barnes you got to continue to look to take and
12:32,752.07,6.36,make those shots timeout tyronn lue see the almost turnover the curry unable to
12:38,758.43,5.94,catch the basketball James just sees the rim in mama call of clay i'ma call him dunked on
12:44,764.37,7.67,big-time finish by James [Music] a chance for their first title in
12:52,772.04,5.79,franchise history not since Jim Brown and the Browns beat the Colts back in 64
12:58,777.83,5.28,and are also working to make NBA history no team ever in the finals of go back
13:03,783.11,10.86,from a 3-1 deficit in fact these Cavaliers only the third team to force a game 7 mega dolla
13:14,793.97,6.95,with the steal you can just see at least early the way he's moving so much better
13:21,800.92,7.12,than he did when he entered the back in Game six you can't turn the ball over like this against superior competition
13:28,808.04,7.62,curry very shell packed the curry corner three five three-pointers in the opening
13:36,815.66,6.18,period for Golden State for one thing playing with the Hall of Famer Reggie Miller I was in awe of his
13:42,821.84,5.64,ability to continue to move without the basketball that was a thing of beauty the way to express it at Steph Curry to
13:47,827.48,5.51,put on Kyrie relief to the fan Irving pulls up stops on a dime and banks it in
13:53,832.99,5.05,that's what klay Thompson said was so difficult about defending Irving his
13:58,838.04,7.08,ability to just stop on a dime as Kevin lob fouls Andy Varejao well
14:05,845.12,5.25,they run a little misdirection to get Irving in the pick-and-roll good balance
14:10,850.37,5.07,and banks at home this terrific defense
14:15,855.44,6.06,by Irving but right now listen Cleveland's within one but this is the
14:22,861.50,7.52,tough this is a tough time right now they've already given up five threes bringing the drive will a pan
14:30,869.65,5.39,and it have been more defensive mistakes than they've made in the last two games
14:35,875.04,9.25,their defense has been sensational in these last two Richard Jefferson goes at
14:44,884.29,5.21,Livingston Kevin Love the offensive rebound back up he's foul shot won't go
14:49,889.50,5.44,Steph Curry picks up his first mehran James getting the rest to the end
14:55,894.94,7.26,of the first Steph Curry and klay Thompson they're gonna need all the guys to make plays tonight draymond Green puts the ball on the deck attacks
15:02,902.20,5.10,Richard Jefferson got his mind made up you're Kyrie Irving you're in position
15:07,907.30,7.53,to help you have to come and put a body in front of draymond Green Curry who fouled out in Game six first time since
15:15,914.83,4.07,2013 that happened picks up his first
15:29,928.60,6.04,love misses the second even though it's the last game the NBA
15:35,934.64,5.04,has become a twelvemonth of year league always something going on and as curry
15:40,939.68,13.20,gets inside kicks it out big adalat rides a three way off and loves the rebound junior Smith long distance can
15:53,952.88,5.91,hit love another offensive board he's got six boards here on the first
15:59,958.79,6.00,gets inside block but foul by berry Chou and a very heaven love down low attack
16:05,964.79,6.12,Oh what coach talked about I love the energy of Kevin Love the start this ball game he's got his mind made up attacking
16:11,970.91,6.39,the offensive boards securing the basketball looking to be aggressive this is a flop like Varejao
16:17,977.30,5.43,good job by not calling it clearly contact the Kevin Love playing with great energy effort and enthusiasm
16:23,982.73,7.71,stocked his game he's averaging just over five rebounds a game in the finals he already has exceeded that here in the
16:30,990.44,7.11,first quarter and for those on the offensive end Mike he had 13 offensive rebounds and 13
16:38,997.55,5.82,rebounds in the first game 14 cents this is what he's got to get back to this is
16:43,1003.37,5.57,who he is well certainly the three-point shot the
16:49,1008.94,5.31,way the game has changed has caused him to change it but it's been so drastic it really has taken away a lot of his
16:54,1014.25,8.19,strengths but the things he was able to do him Minnesota he can still do today it's a mindset bearish out drives
17:02,1022.44,8.64,left-handed as he felt the bump and that's going to be never love second foul Andy Varejao of a former Cavalier
17:11,1031.08,5.88,traded this year a beloved figure in Cleveland for a long time well love's
17:17,1036.96,7.35,got him going away from the basket right here that's clearly a foul and you've just got to make him finish that you
17:24,1044.31,6.96,already have one foul you're too good and too valuable their jaw has not
17:31,1051.27,7.23,played a lot of minutes but he's had an impact in example Game seven in the Western Conference Finals against OKC he
17:39,1058.50,5.70,had about a two-minute stretch we really helped turn things around in that victory and that advanced them to the
17:44,1064.20,5.73,finals he was disappointed he was traded traded to Portland let go and then
17:50,1069.93,5.64,signed by Golden State his wonderful Bron James favorite teammates in his
17:56,1075.57,6.45,career in Cleveland at 11 and a half years with the Cavaliers love another
18:02,1082.02,6.08,rebound when we see Bob Olsen to close out this quarter for Steph Curry the guy to gave
18:08,1088.10,6.75,up a lot of quality minutes in this series two-speed current warriors it was about a second and a half difference
18:15,1094.85,6.24,between the shot clock and game clock Barbosa picks up James James goes right
18:21,1101.09,7.05,at him and draws the foul and James will shoot his first free throws of the night raises his arm as he walked past a
18:28,1108.14,5.76,couple of the Warriors and to me coach in doing the warrior you're doing the Cavs a favor
18:34,1113.90,5.04,if you're switching Barbosa a curry or any of the small gods on LeBron James is
18:39,1118.94,6.48,too easy I'd much rather have dream on green on doing it now on defending a
18:45,1125.42,7.47,little small contact but this is game 7 you can live with that but I'd rather have those guys staying connected to LeBron yeah I agreed that the switch of
18:53,1132.89,6.42,the small unto him whether it's curry or Barbosa he can eat just too overpowering
18:59,1139.31,7.26,keep your size on him and this times
19:07,1146.57,5.40,when you have to but in this situation if we Dalek it it went underneath the screen and got back to the body of James
19:12,1151.97,5.25,once he sees ball bowl saw curry oh no his mind is made up to attack and force
19:17,1157.22,3.47,help I'll make a play at the rim
19:23,1162.63,6.69,ahran sits down marreese Speights will check in for the first time and Mike this is where Shumpert and the Cavs
19:29,1169.32,8.78,can't make a mistake Curry's too good late quarter you've got to make the ball go to somebody else other than curry
19:40,1179.72,5.62,James hits affair final seconds curry tied up to the
19:45,1185.34,7.17,adalat not gonna get it off in time that will not count and the first quarter comes to an end
19:53,1192.51,7.08,that's terrific defense right there Mike meanwhile LeBron James six point six
19:60,1199.59,6.87,boards and three assists already the Golden State finding the mark from downtown live at five threes two of them
20:06,1206.46,6.49,from Steph Curry after one Cavs by one [Music]
20:13,1212.95,6.63,your defense the last two games has put you in this position but they made five threes how problematic are those but we
20:20,1219.58,6.84,got to be a little bit between us which is what we're doing defensively I don't think we're executing this as how the level we need to so we've gotta clean up
20:26,1226.42,5.97,a few things defensively but we'll be okay LeBron James affecting the game in all kinds of ways but three early turnovers
20:32,1232.39,5.91,what were those our product up just not being aggressive attacking no trying to think the game just play the game
20:38,1238.30,6.03,I think he's overthinking this got to be aggressive attack the bastard thank you John Livingston the jumper Thank You Doris
20:44,1244.33,6.66,well James is played in obviously so many big games and he's going to play in so many more but you can make a case
20:51,1250.99,6.45,that this is the most important game of his career Jefferson gets inside nice
20:57,1257.44,6.75,fake blocked by Speights picked up by Jefferson throws it back out shut with shot clock did not reset Shumpert off
21:04,1264.19,6.36,the mark space rips down the rebound here comes Iguodala Mo Williams has come
21:11,1270.55,5.73,on here for Cleveland and a ball kicked by Shumpert Thompson tried to go back
21:16,1276.28,5.40,door warriors ball and you see the
21:22,1281.68,7.26,team's trying to figure out how to defend each other James matched up with mo Speights trying to take away his
21:29,1288.94,5.31,ability to pick and pop and Tristan Thompson on draymond Green trying to make sure he's able to defend the
21:34,1294.25,5.19,pick-and-roll and an offensive foul called on draymond Green or is it on
21:39,1299.44,8.54,Thompson he's actually on klay Thompson pushing off the launch help it to get open klay Thompson picks up his first
21:51,1310.61,7.24,there's Williams three-pointer Mo Williams too strong Speights another rebound it's just two on aggressive
21:58,1317.85,5.21,offensively trying to orchestrate too many things
22:03,1323.18,6.94,Livingston shoots over mole Williams not that time rebounding numbers plus eight
22:10,1330.12,5.37,for Cleveland James drives him hard nice adjustment with the left hand
22:15,1335.49,7.31,[Applause] eight points now for James
22:28,1347.57,7.25,Green with Chum perdóname and a foul call on Tristan Thompson
22:38,1357.80,6.43,again don't over think as tyloo said at the quarter break attack a great use of
22:44,1364.23,5.85,slithering by the help defender and a beautiful left hand finish my mistake
22:50,1370.08,8.88,that foul on mo Williams's Green Drive left-handed too strong Speights with the tip won't go tips in a second time green
22:59,1378.96,14.28,and never reestablished back in might when he tucked the ball so considered out of bounds very close though Green
23:13,1393.24,7.65,did not argue officiating crew Danny Crawford Monty McCutchen and Mike Callahan combined they've worked 66
23:21,1400.89,7.38,Finals games this is one of the most experienced group Malik can add James drives misses that one klay Thompson the
23:28,1408.27,6.78,rebound Thompson long distance space and
23:35,1415.05,6.06,a loose ball foul called against the Cavaliers in like we talked about the
23:41,1421.11,6.80,energy of Kevin Love mo Speights has brought that same presence off the bench for the warrior attacking the board's
23:48,1427.91,5.38,defending with the purpose about this shot goes up clearly a push in the back
23:53,1433.29,6.69,by Tristan Thompson second tile on Thompson huge foul because now remember he switches out on
23:60,1439.98,6.42,a lot of these guards they put it on the ground and attacked Livingston gets rid
24:06,1446.40,4.97,of Jefferson with a fake but can't hit the follow off the glass
24:19,1458.58,6.00,we've already had seven lead changes in four ties mo Williams the drive unable
24:25,1464.58,6.06,to finish green leading the break greens pass stolen by James and Mo Williams all
24:31,1470.64,6.84,alone LeBron James had four steals in Game six three in Game five and that one
24:37,1477.48,9.63,leads to an easy bucket you may be able to deflect that but who can catch it out of the air LeBron James asked and
24:47,1487.11,6.51,answered his defense also a big part of his unbelievable performance in these
24:54,1493.62,5.73,finals has draymond Green knocks down the three much more confident and
24:59,1499.35,5.22,comfortable than he was in Game six he
25:05,1504.57,7.35,had missed 12 straight threes coming into the game so he was too tentative coming back after being suspended for
25:12,1511.92,7.50,Game five Speights on Shepard shot clock at five Shumpert the drive kicks it out
25:19,1519.42,3.80,Williams and Williams was out of bounds
25:26,1526.19,8.89,timeout great read by LeBron James Nick Anna off
25:35,1535.08,5.43,a dream on green pass a minute touch pass to Bo Williams for the easy layup
25:41,1540.51,5.01,and green giving him space no hesitation
25:46,1545.52,6.58,knocks in the three 2.4 your leader [Music]
25:52,1552.10,5.84,[Applause]
26:03,1563.11,9.02,Iguodala Livingston green Thompson and space greens jumper
26:13,1573.12,7.42,name's looking to push at every opportunity back up top to Kevin Love straight on three mega dolla the rebound
26:21,1580.54,6.54,there now old four seven from three-point range Golden State 6-4 thirteen I like the
26:27,1587.08,6.54,mindset though getting stops and pushing the basketball that's where they're gonna get better offense if you're the Cavs against this outstanding tutoria
26:34,1593.62,6.11,defensive team Speights poked out of bounds
26:40,1599.73,7.02,Iguodala deflected it but it looked like it may have touched one of the Cavs so the officials are going to get together
26:47,1606.75,6.49,Mike Callahan says the other way never
26:53,1613.24,6.51,touch Livingston it was all verbing good teamwork by the reps that's not easy to
26:60,1619.75,7.65,see either sometimes and it's rare but sometimes the official furthest away as an angle is the play can eat up the
27:07,1627.40,6.21,official close to the play and McCutchen checking with Callahan low a new 24 for
27:14,1633.61,5.28,Golden State and these baseline out of bounds plays are tough to defend you
27:19,1638.89,7.71,have to be alert and aware with discipline curry back in Thompson off the screen 3-pointer way off and Irving
27:27,1646.60,6.39,comes away and to me this is the dangerous lineup against LeBron James with nobody's the ability to block shots
27:33,1652.99,7.95,in the paint I'll protect the rim he turns the corner a green defending him it's all smalls helping ball is
27:41,1660.94,4.37,deflected 16 to shoot for Cleveland
27:46,1666.16,9.19,[Applause] Jr Smith good clean look love and a foul
27:55,1675.35,5.43,ball on Harrison Barnes down low trying to hold off Kevin Love who's been a beast on the boards here in the first
28:01,1680.78,6.78,half and that was great out of bounds execution by the Cavs to get a wide-open
28:08,1687.56,5.73,jr. Smith three and this is what Kevin Love was not doing previously he was not
28:13,1693.29,9.63,getting from the perimeter to the board as the shot was taken curving looking
28:23,1702.92,7.50,for James picked by Green so though we set the shot clock to 14 [Applause]
28:30,1710.42,6.41,[Music] [Applause]
28:37,1716.83,7.08,green guarding James now Thompson picks them up on a switch names behind the
