59:34,3574.04,5.64,Curry's coming off and that draymond Green defense Lee would be up he's puzzled Tyrese urban ability to get to
59:40,3579.68,5.49,the paint you got to give him a little bit of room elevates and makes the right play and I'll be surprised Mike if
59:45,3585.17,6.33,Golden State goes back to playing either as Ely or Varejao this has been their
59:52,3591.50,5.52,best chance five smaller guys and now the question is can love and Thompson
59:57,3597.02,5.43,stay on the floor defensively Thompson
60:02,3602.45,2.90,on Irving
60:08,3608.22,5.91,Irving looking for that opening green picks him up tries to find Tristan Thompson Tristan Thompson downloads
60:14,3614.13,8.34,struggled and he got bumped by green and they're in the penalty so Tristan Thompson will shoot to second foul on
60:22,3622.47,6.72,draymond Green Mike remember the struggles Tristan Thompson has gone
60:29,3629.19,8.22,through in the finals from the free-throw line a little bit better last game overall just 50% when you see the
60:37,3637.41,8.55,13 of 26 calmly knocks it down what a game he had in Game six 15 points and 16
60:46,3645.96,5.70,rebounds had that old for five in Game
60:52,3651.66,5.13,four and then the Miz six more in Game five but last couple of games much
60:57,3656.79,10.14,better [Applause] and it's a pair their score here in this
61:07,3666.93,11.55,third quarter 28:14 in favor of Cleveland they lead by seven with just over three to play green
61:18,3678.48,7.68,draws the foul on James LeBron James picks up his first a smart
61:26,3686.16,8.09,play by draymond Green realizing he's being defended up close by LeBron James the swing move
61:34,3694.25,7.07,contact [Applause] they often pull that out of bounds and a
61:41,3701.32,5.61,side-to-side swipe Greene tried to go up as quickly as possible warriors get the benefit of the doubt on
61:47,3706.93,5.10,that one and free throws for Greene that's his first point to the third
61:52,3712.03,5.28,quarter after 22 in the first half every one of these calls will be so
61:57,3717.31,7.80,scrutinized you're at seven you've got a good defensive sequence get going on ball pressure beyond the three it looks
62:05,3725.11,10.92,dead and that could have easily not been called as well draymond Green who was
62:16,3736.03,13.59,second in the NBA and triple doubles during the regular season with 13 milori errs record he's got 24 7 and 6 and hits
62:30,3749.62,13.59,all three the lead for Cleveland cut to 4 [Applause]
62:43,3763.21,5.11,gets away now green picks them up [Applause]
62:48,3768.32,5.50,six to shoot James drives into the lane wild shot can't get at the pole and a
62:54,3773.82,8.84,loose ball foul again been stolen state Tristan Thompson and his relentless pursuit of the ball draws the foul
63:03,3782.66,6.28,Barnes his third up to me this is why the Atty lose you stay with a big on the floor it's depression at Tristan
63:09,3788.94,6.69,Thompson on Kevin Love puts on the smaller guys trying to box them out on opposite side keeping them off that
63:16,3795.63,6.65,offensive glass Thompson has been so big in there coming back from three one down
63:22,3802.28,6.31,and hits yet another free throw love with the winner championship he's
63:29,3808.59,5.10,talking about his dad Trevor yesterday work two jobs growing up said he's the one that brought toughness to the family
63:34,3813.69,7.20,his dad's not here today but he's watching seven points three rebounds so
63:41,3820.89,6.23,far tonight and I'd be remiss if I didn't say Happy Father's Day to my dad
63:47,3827.12,8.17,such an influence great man's coach Bill Van Gundy amen to that my dad read for
63:55,3835.29,7.72,free what a game for draymond Green 6 of 7
64:03,3843.01,5.01,from downtown Mike not just the shot but
64:08,3848.02,3.83,a tremendous find from Shaun Livingston
64:14,3854.46,7.53,mega dollars shuts off James five to shoot curry knocks it away James at half-court spins drives the runner at
64:22,3861.99,7.22,the foul lines mrs. Thompson tips it picked up by curry curry the lowering Stan throws it down
64:29,3869.21,4.95,but the game is tied timeout Cavaliers
64:45,3884.55,5.64,what a ballgame warias not quitting great delivery from curry limits it does
64:50,3890.19,6.27,the rest get in my poster Tristan Thompson and how about the wonderful pass off the pick-and-roll limits that
64:56,3896.46,5.85,little touch get it to the seams behind the back in rhythm OnPoint agreed he
65:02,3902.31,6.26,does the rest we have ourselves a ball [Music]
65:09,3908.57,5.76,Oracle Arena roaring once again Dave Chappelle
65:14,3914.33,5.53,watching Dwayne Wade surprising LeBron James with the visit here to the game
65:20,3919.86,7.97,Russell Wilson and Ciara sit at courtside it's a hot ticket one guy paid
65:28,3927.83,6.88,49,500 each for two seats the biggest ticket price ever on StubHub Mike stop
65:35,3934.71,5.91,telling my business man that's my money and we have finally seen a game going
65:41,3940.62,5.70,back and forth there's been some brilliant individual performances and some great team efforts but we have not
65:46,3946.32,5.55,out of close game yet in these NBA Finals right now we're tied with just under two to play here in the third and
65:52,3951.87,6.36,Mike to me it all switched on the foul on draymond Green behind the three-point
65:58,3958.23,5.13,line a huge momentum swing James look at
66:03,3963.36,7.24,a post up Shaun Livingston max in tough follow a shot it's good
66:11,3970.60,7.00,living to play a while James was just better that's good defense my limits that's the shot you want LeBron James to
66:18,3977.60,7.05,take in that situation curry finds green
66:25,3984.65,4.61,Green fakes kicks it out Barnes for three
66:33,3993.29,5.31,Harrison Barnes struggling much of the series that's his second three-pointer
66:39,3998.60,4.88,he's got ten [Applause]
66:45,4004.79,6.07,Earvin resets right back to James against Livingston Jefferson cuts they
66:51,4010.86,12.15,go to Thompson Thompson puts it on the floor across the lane left-handed it's good Tristan Thompson but this is a hard unit
67:03,4023.01,5.79,for Cleveland to defend curry nearly falling now wild shot Iguodala comes up
67:09,4028.80,7.40,with a rebound Tristan Thompson deny curry
67:17,4036.87,6.54,shot clock winding down 224 curry the runner is up in and out and Jefferson
67:23,4043.41,6.24,the rebound that's great defense by freshman Tom you will not find another Senen League able to defend him without
67:30,4049.65,5.10,the basketball and then under control Irving trying to draw contact pulls up
67:35,4054.75,6.90,won't go we're good I love the rebound shot clock turned off as we wind down the third but poor use of the shot clock
67:42,4061.65,6.81,they got it back with a four-second differential and they shot it way too early big adalah inside finds room and
67:48,4068.46,6.09,finishes 3.2 remaining Irving will have
67:55,4074.55,5.43,a chance to get off a shot from half-court it's up and the third quarter
67:60,4079.98,7.68,comes to an end Game seven of the NBA Finals a one-point game as we head to
68:08,4087.66,5.22,the fourth Kyrie Irving coming alive
68:13,4092.88,5.00,here in this third 12 of his 21
68:18,4098.06,5.08,at one point Cleveland had a seven-point lead right now it's Golden State by one
68:23,4103.14,8.66,[Music]
68:32,4111.80,8.20,fourth-quarter Game seven a one-point game moments ago Doris Burke with c-curve Mike thank you Steve final 12
68:40,4120.00,5.97,minutes what must your guys do trust each other you know we got a little away from that in the third quarter keep
68:46,4125.97,5.31,moving the ball and good stuff happens I thought we got a little careless an
68:51,4131.28,6.48,entire NBA season coming down to one final quarter to decide a champion Kevin
68:58,4137.76,7.02,Love LeBron James Kyrie Irving Richard Jefferson and Shumpert out there for Cleveland they go to love the Dallas on
69:05,4144.78,6.51,him shot clock back to five James drives gets in the paint puts it up and puts it
69:11,4151.29,6.63,in and again good movement when the ball went in to love Jefferson said a flare
69:18,4157.92,7.35,screen the ball came back to James and there was a huge driving gap for him to attack Steph Curry on the bench for
69:25,4165.27,5.82,Golden State to start this fourth it's Livingston Thompson Barnes green and
69:31,4171.09,7.29,Iguodala five to shoot Livingston love grabs his twelfth rebound
69:39,4178.60,6.09,[Applause]
69:45,4184.69,5.35,James falls out of sit Jefferson sets a screen again shot clock
69:50,4190.04,5.91,winding down and the Love has it against green for on the 24 back to James fires
69:56,4195.95,5.85,from Prague and another loose ball foul I believe it's going to be against
70:02,4201.80,6.43,Iguodala he's upset [Applause]
70:08,4208.23,9.11,first team foul third on Iguodala [Applause]
70:17,4217.34,5.69,yeah he's rat he got his arm that's a good call
70:23,4223.03,6.54,James drives on Iguodala shut off nicely back out love good Kevin love you gotta
70:30,4229.57,6.69,look to shoot the basketball bacon please pull you got smaller guys on you you got a capital not that time he does
70:36,4236.26,6.09,right on cue mark with klay Thompson switching on him Kevin Love with his third field goal he's played well if
70:42,4242.35,5.40,you're Kevin Love you got to think his disrespectful the switch is small on me and take advantage of the matchup nine
70:48,4247.75,6.75,points 12 boards for love mega dolla back up top Barnes fakes strives pull-up
70:55,4254.50,5.25,jumper too strong and James grabs his ninth rebound he's one rebound away from
70:60,4259.75,6.36,a triple double love double-team stolen
71:06,4266.11,2.99,by klay Thompson
71:12,4272.40,7.74,stream on green drives back to Livingston his runner won't go late whistle little foul as Livingston got
71:20,4280.14,6.90,hit LeBron James has words who Danny Crawford goes right back at him as the
71:27,4287.04,7.74,foul is on Irving his third [Applause]
71:35,4294.78,5.59,is the explanation doesn't seem to be registering and clearly contact on the
71:40,4300.37,8.01,elbow of Shaun Livingston that's that's the correct call good eyes Livingston who is the hero of Game one twenty
71:48,4308.38,7.56,points off the bench eight of 10 from the field in that game now brings the Warriors within two both
71:56,4315.94,7.41,teams shot the ball very well from the free-throw line today in nine of ten for Golden State
72:03,4323.35,5.85,17 of 20 for Cleveland in the close game like that free throws always critical
72:09,4329.20,11.51,often decide who wins and loses and tonight that would be who wins and loses the championship back to one
72:28,4348.34,6.87,play Thompson on James six two two James drives kicks it out
72:35,4355.21,2.84,stolen by Iguodala
72:40,4360.33,13.65,to two consecutive turnovers off of Thompson that one halfway down cattle of
72:54,4373.98,6.55,wants to post up against plate ops and there's the double genes [Applause]
73:01,4380.53,6.27,Irving's drives on Green gets inside off-balanced comes up short gets his up rebound and puts it back
73:07,4386.80,5.92,layering the second effort and Steve Kerr calls timeout as the Cavaliers go
73:13,4392.72,6.12,up by three he has been spectacular waited for this moment and has capitalized he is outplayed Steph Curry in these
73:19,4398.84,6.24,finals curry back in the game number even watched a number of the games in the finals last year from the hospital
73:25,4405.08,5.66,after knee surgery seven to shoot
73:31,4410.74,5.71,good falls on out from Shepherd Green drives on James and finishes great play
73:36,4416.45,6.33,by draymond Green before defense by LeBron James you got to do a better job keeping them in front faucet of the
73:43,4422.78,5.75,shield a 30 point game for Trayvon Green [Applause]
73:49,4428.53,5.85,Shumpert LeBron James wants it back [Applause]
73:54,4434.38,7.82,couple of jabs Dixon out corner low for three and
74:02,4442.20,5.73,Barnes grabs the rebound terrific individual defense by Iguodala right
74:08,4447.93,6.91,there Thompson Watson looking to post-up Kyrie
74:15,4454.84,6.96,Irving fakes drives kicks it back out Barnes a good look an urban grabs the
74:22,4461.80,5.70,miss but that's the right play maker miss you want egg with dalla and Barnes
74:28,4467.50,9.06,having to shoot range jump shots Irving crossover stops pulls up jumper won't go rebound green curry ahead to
74:37,4476.56,10.86,Iguodala Iguodala all the way and draws the foul as Jefferson pumpkin you say how does
74:47,4487.42,6.60,Iguodala get such an opening is because LeBron James were putting the binding either help and leave klay Thompson wide
74:54,4494.02,5.22,open in that corner which would be a layup allow it would dolla to the lane
74:59,4499.24,5.82,good foul by Richard Jefferson but good basketball by the Warriors and it started that poor transition defense
75:05,4505.06,6.15,with Irving pursuing for a second shot after his miss Lena Dawa this is the
75:11,4511.21,6.48,free throw forcing LeBron James is it
75:18,4517.69,5.46,without misses two free throws to basically be the point dog with this group this is a crucial stretch so gutsy
75:23,4523.15,6.57,move took out Love and Kyrie Irving so where is the offense going to come as
75:30,4529.72,5.67,much of two missed free throws jockbox been winding down many of those halves
75:35,4535.39,6.14,possessions here to start the fourth James drives down the lane running shot banks and it's good
75:42,4541.53,6.07,there's no secret he's much more comfortable with anybody else's defending him not name Iguodala he's
75:48,4547.60,7.47,passed off a lot of those today certainly more so than he did in games five and six Curry's got Tristan
75:55,4555.07,5.85,Thompson on curry crossover three-pointer Xcode step from way
76:01,4560.92,8.22,downtown and were tied again a great shot pretty good defense by Thomas his
76:09,4569.14,2.75,fourth three-pointer
76:20,4579.86,5.53,James season-opening kicks it out in the corner back up jumper right side Smith
76:25,4585.39,9.28,fakes dribbles three-pointer short no good hanging out on the rebound Iguodala
76:35,4594.67,6.15,Thompson fakes Thompson fires a two-pointer for klay Thompson they'll
76:41,4600.82,4.55,review it but the call on the plaza to
76:46,4606.33,6.07,Tehran Lou on the court calling timeout and arguing with Mike Callahan as Golden
76:52,4612.40,5.13,State regains the lead II coach you
76:58,4617.53,6.23,talked about he got a closeout to the body of these shooters you close out short you're too late
77:04,4623.76,6.37,beautiful shot by klay Thompson how about this Steph Curry Tristan Thompson that's good defense but
77:10,4630.13,8.70,late on the contest curry gets to his spot we've seen that for two straight years now fine good the scene in
77:19,4638.83,6.99,Cleveland they've shut down downtown there's so many people downtown as you see the fans gathering you can't imagine
77:26,4645.82,7.14,the wider range of emotions of these Cleveland sports fans stress and anxiety elation and hope for
77:33,4652.96,6.39,many of them have waited over five decades worth of frustration and disappointment and LeBron James deliver
77:39,4659.35,5.57,that title we've got just over six minutes to find out and interestingly
77:45,4664.92,7.39,Healey goes back in the game James drives down stops picks it back ups
77:52,4672.31,8.21,Jefferson to jumper can't get at the pole and bringing the rebound his tenth he's two assists shy of a triple double
78:04,4684.00,7.31,curry with Jefferson leaning on him curry drives scoop layup mrs. green on the follow
78:17,4696.62,6.63,32 points for draymond Green the sealy now guarding James is as Healy's back in
78:23,4703.25,5.59,Manas Healey goes for the fake James draws the foul and it appeared he was
78:29,4708.84,5.18,beyond the arc Monty McCutchen checking with his fellow official to make sure
78:34,4714.02,7.06,it's good offense my Steph Curry getting into the seams forcing the help and draymond Green crash in the opposite the
78:41,4721.08,7.29,offensive board from the weak side is a good basketball Green has been spectacular all night long out working guys on the
78:48,4728.37,7.20,floor so they will check to make sure go to the replay and as Crawford over there
78:56,4735.57,5.52,he's saying three point three point attempt so three free throws but to me
79:01,4741.09,5.01,clearly contact by Ezeli he's behind the three-point line the coachella novi
79:06,4746.10,5.10,agree but there's no reason to switch in that situation you're doing the Cavs a
79:11,4751.20,7.32,favor by switching Ozzy Leon's into LeBron and I'll add another one there's no reason to contest coming off your
79:19,4758.52,5.60,feet James has not made a three today
79:24,4764.24,6.09,it's the first free-throw then it's back to three you always have to convince your bigs
79:30,4770.33,5.55,not to leave their feet when they're contestant out here beyond the three
79:36,4775.88,5.57,just put a hand up don't fight I'm Cleveland and you're gonna switch
79:41,4781.45,7.11,that pick-and-roll I'm coming back down and running the same exact action let's see me do it again James now 6 of
79:49,4788.56,5.33,7 from the free-throw line he has done some extraordinary things in his career
79:54,4793.89,5.14,what a victory tonight would be his greatest accomplishment in bringing a
79:59,4799.03,7.89,title back to Cleveland his team down by two with just under five and I have to play and he hits all three clutch free
80:07,4806.92,5.40,throws there Cavaliers talking about how they're going to defend their pick-and-roll with Steph Curry and the
80:12,4812.32,5.57,message comes they want to switch the pick-and-roll now he throws it away an errant pass
80:18,4817.89,7.27,10th turnover for Golden State this a bad play and he knows it a bad decision
80:25,4825.16,7.06,these are the plays that he's got to eliminate especially closing out games and that's his fourth turnover
80:32,4832.22,5.56,[Applause] Lakes is completely slowed down we see
80:38,4837.78,6.51,the big pick and roll again and they switch again good job by draymond Green getting back five to shoot
80:44,4844.29,7.80,Azealia again goes back up on him game steps back for three pops it in LeBron James from downtown and the Cavaliers go
80:52,4852.09,7.14,up by two 26 for James Thompson gets way
80:59,4859.23,4.22,from Smith drives left hand it off the glass
81:04,4864.45,5.67,and Steve Kerr going back to Harrison Barnes I'm sure for as Ely and love
81:10,4870.12,6.12,coming back in as well that is no knocked as Ely just bad been planning as
81:16,4876.24,6.12,far as putting him on the body of LeBron James it's easy office and you're allowing him to attack once again as Ely
81:22,4882.36,5.43,James this time goes Adam pulls back to point shots and green grabs another
81:28,4887.79,7.38,rebound his 12th curry downtown off the mark
81:35,4895.17,8.64,Jefferson able a snare it and Mike we're used to seeing that's great off it's a great screen him wide open for what used
81:44,4903.81,7.71,to seeing that one going down Irving's trying to get away from the double-team throws it back up to James James to
81:52,4911.52,7.08,Smith seven to shoot James backing up against curry 1 on the
81:59,4918.60,6.09,shot clock way off the mark and a 24-second violation for knocked out of bounds and
82:05,4924.69,6.65,it's going to be Golden State ball with 3:40 remaining Harrison Barnes is going to come in for
82:11,4931.34,5.91,his Ely we've had 20 lead changes and 11
82:17,4937.25,5.10,ties and the reason why that doesn't hurt you defense Lee because marine is
82:22,4942.35,5.91,defending Tristan Thompson so when the pick-and-roll comes is green switch him with Iguodala and it makes you better
82:28,4948.26,6.33,offensively also with bonds on the floor game 7 is tied with three and a half to
82:35,4954.59,2.90,go here on the 4th
82:41,4960.96,6.72,graeme back to Thompson Thompson spins shoots over Irving can't get at the fall
82:48,4967.68,6.39,and Kevin loved his 13th rebound again I think Cleveland would be better served to get into whatever they're getting
82:54,4974.07,8.51,into quickly now we're gonna see Jo Smith probably set the screen Jenny curry in the action
83:03,4983.24,6.34,curry now picks them up five to shoot James powers drives and Alain missed it
83:10,4989.58,6.36,big adalat consistent draymond Green
83:16,4995.94,6.29,kicks it out Iguodala for three rebound James and he's fouled by curry
83:22,5002.23,5.98,that's gonna be four fouls on curry third team foul and we'll take a timeout
83:28,5008.21,5.19,as we get under the 3-minute mark but
83:33,5013.40,5.25,you want to win this has got to be the mindset this is good defense and good offense that's both ways championship
83:39,5018.65,6.72,effort and on the other end clearly the contact by curry Lawson James that go down we have
83:45,5025.37,4.79,ourselves a ballgame a champion soon to come
83:51,5031.01,5.53,250 remaining fourth quarter of Game seven the only triple-doubles in the
83:57,5036.54,7.29,history of the game seven of the finals were from Jerry West and James Worthy until tonight as LeBron James with 26 10
84:04,5043.83,6.15,and 11 Green this time the power move to the
84:10,5049.98,6.78,basket but Iguodala right there that's Bailey contact jump addala got away with
84:17,5056.76,6.14,it and those are the tough calls to make
84:23,5062.90,6.21,[Music] meanwhile draymond Green one assist shy of a triple double to join James Irving
84:29,5069.11,9.33,we'll bring it up ain't holding throws
84:38,5078.44,7.41,it in the lock guarded by Barnes long a little jump hook short rebound green 14 rebounds for draymond Green to
84:46,5085.85,3.32,go with 32 points
84:53,5092.93,7.17,curry finds Iguodala drives kicks it out Barnes pawns outdegree puts up a three
85:00,5100.10,7.17,and Cavs get it back with two eleven remaining that's great rotation by the
85:07,5107.27,8.43,Cleveland Cavaliers James closes to the opposite corner love pulls the trigger on two greens terrific
85:16,5115.70,5.72,defense and very good offense by the Warriors and good offense on the cows part the last possession with love
85:21,5121.42,6.78,taking a tough shot but a bump Kyrie Irving on LeBron James the offense is running to me right now [Applause]
85:28,5128.20,5.56,Irving drives hop step inside pulls up misses rebound taken by Iguodala
85:34,5133.76,9.35,they go down low to curry back there go down low up for the lamb Oh blocked by James LeBron James with the rejection
85:43,5143.32,5.89,Wow this third block of the game as we
85:49,5149.21,5.19,come up on a middle of the half remaining but again get into your stuff
85:54,5154.40,7.28,quicker [Applause] for a shoot James inside little jump
86:02,5161.68,4.61,hook that short rebound tipped and taken by curry
86:10,5169.64,6.51,Perry drives on Irving pulls back for three listen even at the rim as Irving
86:16,5176.15,7.65,comes the yellow egg and Tehran Lou wants a timeout makes one of his final
86:24,5183.80,5.93,two timeouts left with 109 remaining and a tie game
86:34,5193.58,7.08,[Applause] oh my goodness
86:41,5201.22,7.65,great pass by curry running hard by Iguodala and superhuman
86:49,5208.87,8.30,defensive recovery by LeBron James [Applause]
86:59,5219.23,6.63,of electrifying Game seven here at Oracle Arena and Mike tyloo elects to
87:06,5225.86,6.38,take out Tristan Thompson insert Richard Jefferson offensively that will give him more space but if it's not a timeout
87:12,5232.24,7.54,defensively that's a real challenge for the Cavaliers against the likes of curry and Thompson
87:20,5239.78,6.54,each team has a foul to give as we come up on a minute remaining and they've put in Korea in the pick-and-roll trying to
87:26,5246.32,7.41,get him on early [Applause] Irving and curry one on one Irving puts
87:34,5253.73,7.56,it up the Cavaliers by three and I like
87:41,5261.29,6.24,the no timeout call by Steve Kerr love
87:48,5267.53,7.29,picks up curry curry steps back fakes the three drives again show up nicely found a green seven to shoot
87:55,5274.82,6.18,curry fakes the three steps back crossover puts up a three rebound James
88:01,5281.00,6.69,1 30 seconds remaining what a spectacular job I love Irving on the drive goes inside lost it
88:08,5287.69,6.69,gets it back and finds low there's a 7 second difference between shot clock and game clock and they had a foul to give
88:14,5294.38,7.50,so Barnes thousand there but that's a bad foul Mike that gives lutely three extra seconds and what was Kyrie Irving
88:22,5301.88,5.67,doing in transition though James will
88:28,5307.55,5.30,inbound now there's a four point seven difference between shot clock and game flyer
88:33,5312.85,5.96,[Applause] Cavaliers have one timeout left and go
88:39,5318.81,5.49,in the backcourt in the last two minutes to get it but they've got to manage this clock they don't want to go early
88:44,5324.30,6.39,Irving drives to James misses the jam but foul James will shoot two free
88:51,5330.69,6.57,throws as he goes down hard with ten point six remaining Cavaliers leading by
88:57,5337.26,7.01,dre Mike that's a good play by draymond Green that's a championship play because he gets the dunk is basically over
89:04,5344.27,6.34,doesn't allow him to get to the paint LeBron takes to spill hopefully he's all right but that's the right defensive
89:11,5350.61,6.84,play by draymond Green James holding on to that right wrist of it the medical staff and almost the
89:17,5357.45,6.65,entire team for the Cavaliers the entire bench running down to see if he's okay
89:28,5367.57,6.67,ten point six seconds remain Cleveland was down eight in the third
89:34,5374.24,5.76,quarter down four here in the fourth and now lead by three let's see the play
89:40,5380.00,2.42,once again
89:47,5386.65,5.34,a great fine from urban and draymond Green that's that's a clean foul it's a
