28:44,1723.91,5.13,back kicks it out Shepard Shumpert counted and one chance for a four-point
28:49,1729.04,10.23,play Iman Shumpert from downtown their first three-pointer of this game it's
28:59,1739.27,6.63,just a great fine by James jumping wide open jump shot good contest by Livingston clearly gets them on the
29:06,1745.90,5.37,right on something with a big shot in that corner jumper just three of 12 from
29:11,1751.27,8.58,downtown on these finals and it completes the four-point play the Cavs go back up by two five minutes gone by
29:20,1759.85,6.54,here in the second curry gets it from Green gets away from Shepherd layup
29:26,1766.39,6.08,[Applause] Marie got hit got the bounce and a
29:32,1772.47,8.11,chance for a three-point play cannot make mistakes on Steph Curry
29:41,1780.58,5.95,James misses a help late help by Irving
29:47,1786.53,5.13,no help by love and then an unwise found by Shumpert
29:52,1791.66,5.67,Irving with his first foul the last game
29:57,1797.33,5.10,said in the curry played was Game seven against Oklahoma City he had 36 points
30:02,1802.43,5.45,and eight assists in that one he's got nine so far tonight
30:09,1808.74,7.52,[Applause] Irving drives and curry reach-in picks
30:16,1816.26,5.10,up his second he's had some foul difficulties not just in Game six when
30:21,1821.36,5.25,he fouled out but in some other ones he said that was his number one focus to start the game don't get in foul trouble
30:27,1826.61,7.41,and his clearly contact he uses the hands on the body of Kyrie Irving that's a foul he's got to be smarter and Trust
30:34,1834.02,6.42,the help behind him is the other guy's responsibility Irving tough fall away shot hits the
30:40,1840.44,8.25,side on the backboard James offensive rebound block ball knocked loose picked up by Green Thompson floats in ahead to
30:49,1848.69,6.42,Livingston off of his leg lost it fifth turnover for Golden State James drives
30:55,1855.11,4.91,curry has to get out of the way and James gets the friendly roll
31:02,1862.34,8.29,James the first Cavalier in double figures with 10 Thompson drives back up
31:11,1870.63,7.62,top green sets for three got it he's three for three from downtown like
31:18,1878.25,6.33,there's certain guys that you were about in Game seven draymond Green is an ultimate competitor he is not afraid of
31:25,1884.58,6.09,the moment whistle offensive foul JR
31:31,1890.67,7.99,Smith and a timeout fall with 543 remaining
31:39,1898.66,7.98,Smith trying to get an explanation but Monty McCutchen was not the official to call this cjr Smith tied up with Steph
31:47,1906.64,6.54,Curry he goes down the right call then
31:53,1913.18,5.28,on the other end draymond Green continuing to step in rhythm good play by klay Thompson you
31:58,1918.46,6.33,work on that every single day to drive and kick steps in rhythm knocks down to jump the
32:05,1924.79,5.34,total number from James who his numbers but he's put up in the finals last year
32:10,1930.13,6.06,against the Warriors and the first six games this year absolutely incredible Thompson can't connect Shumpert the
32:16,1936.19,5.25,rebound Marichal back ends with Iguodala Thompson curry and green
32:21,1941.44,6.40,[Applause]
32:28,1947.84,5.26,starting five out there right now for the cast shot clock down to seven Irving
32:33,1953.10,6.24,sets for three short rebound knocked out of Chopra's hands Iguodala curry tries
32:39,1959.34,7.41,again left-handed blocked by James rejected out of bounds he's done that a couple of times in these finals and the
32:47,1966.75,5.57,two of them have some words Shumpert getting involved
32:53,1973.47,7.29,one of the blocks in Game six at James block curry and then looked out on the net some things to say
33:05,1985.31,6.07,you see the track down by LeBron it's big time defensive play since you know
33:11,1991.38,6.24,my work remember me Thompson drives on love gets past layup
33:18,1997.62,7.22,short rebounding a dollar man Topsail reset curry for three
33:25,2004.84,6.73,JR Smith runs it down and we're the Cavs were so effective in the previous game
33:32,2011.57,6.29,was creating matchups by pick-and-roll the Warriors have done a very good job making the adjustments defensively
33:38,2017.86,6.60,[Applause] Cleveland's just too slow getting into their stuff right now
33:44,2024.46,5.77,Irving drives into the lane layup rolls around and drops in Irving's third field
33:50,2030.23,5.76,goal he's been averaging over 27 a game including the last time he was on this
33:56,2035.99,5.84,floor when he had 41 in Game five [Applause]
34:02,2041.83,10.99, dolla pass deflected Green tries another three draymond Green 4 for 4 from downtown he
34:13,2052.82,5.34,admits his previous 10 coming in the game 7 Irving off the glass and one
34:18,2058.16,9.36,gorgeous move from Kyrie Irving and a chance for a three-point play the coach
34:28,2067.52,6.21,talked about it you put yourself in position to be affected by playing with pace pushing a basketball on the up the
34:34,2073.73,8.49,floor creates this opportunity and angle for Ervin to get the finish and the contact spectacular play play Thompson
34:42,2082.22,6.34,picks up his second foul so Thompson and curry each with two and there's the fan fest outside Quicken
34:49,2088.56,10.05,Loans Arena what a performance so far by draymond Green no Mike I mean to have 16
34:59,2098.61,6.09,4 rebounds and 5 assists already what a performance all tied up just under four
35:05,2104.70,5.76,to play here in the second he said he let his teammates down with
35:10,2110.46,6.99,the suspension in game 5 did not play particularly well in game 6 and it's not lending it running them down here in the
35:17,2117.45,5.46,first half of game 7 he was their
35:23,2122.91,7.17,leading assist man all season sixth in the entire NBA gets it back green for
35:30,2130.08,2.24,Trey
35:36,2135.60,9.39,five four five [Applause]
35:45,2144.99,6.75,James on the drive lap count ahead 1 LeBron James another attack of the
35:52,2151.74,5.36,basket and he's got a free throw coming up [Applause]
35:57,2157.10,6.85,well good show by curry and then James with a little shake and attack takes on
36:04,2163.95,6.03,the contact and at the other end again confusion with the movement once the
36:10,2169.98,6.75,ball goes into the post if I'm Cleveland the first thing I'm going to try to do is get around in front of the post more so they can't
36:17,2176.73,5.79,just throw it in there and start their split action but also on the action LeBron James looking at Shumpert saying
36:23,2182.52,6.66,you got to talk come on Shumpert that's your fault that was LeBron James fault why draymond Green got open on that last play green
36:29,2189.18,10.56,the rebound that foul is on Iguodala his first big addala fakes shut off
36:40,2199.74,5.58,nicely by Jefferson Barbosa shot blocked by James Barbosa goes crashing to the
36:45,2205.32,6.75,ground here's Irving finds James as a trailer throw it behind flips and a Shepherd in
36:52,2212.07,7.60,and out and green grabs another rebound [Applause]
36:60,2219.67,6.26,Thompson for three and jr. Smith able to get it
37:06,2225.93,5.02,[Applause]
37:11,2230.95,8.28,Irving can't connect three-point shooting nine for Golden State just one
37:19,2239.23,3.92,of 12 from that distance for Cleveland
37:25,2245.49,5.11,Green looking to post-up jr. Smith makes
37:31,2250.60,7.28,his quick move stops underneath last ice good twenty-one points for draymond Green
37:38,2257.88,2.93,here in the first half
37:45,2265.35,5.95,the 2016 finals it is about time because the Warriors have decided to go green
37:51,2271.30,5.43,with draymond Green that is spectacular first half having his way along the
37:57,2276.73,19.17,three-point line and also on the post room grown man move completes the
38:16,2295.90,5.40,three-point play 22 now for draymond Green the four-point lead
38:21,2301.30,9.60,is the largest by either team both have led by four at one point here in the first half turn over legged Allen almost
38:31,2310.90,8.18,double dribble pass inside Thompson out to Barbosa much ahead
38:42,2321.66,6.20,ten three-pointers for Golden State largest lead of the half
38:56,2336.17,6.69,Shepard out to Smith jr. Smith chased off the line and fires and misses rebound Tech by Thompson football Bosa
39:03,2342.86,6.27,can't hold on and a Cavalier is getting a new 24 the other calves you got to do
39:09,2349.13,5.31,a better job taking care of basketball but I love to play by klay Thompson we saw the dribble penetration making a
39:14,2354.44,8.06,play for draymond Green that time to cut and the touch pass the beautiful touch pass to Bob Olsen to call
39:27,2366.64,5.66,urban tries again Agudelo once again knocks it away in a health all the
39:32,2372.30,6.48,amazing hands of huh traded Allah with deflections and steals
39:41,2381.09,5.33,it's going to be hard to get quality shots in that tied up window against a
39:46,2386.42,6.31,great defender like Iguodala good hustle by both Irving and green and obviously
39:53,2392.73,9.23,right now a big one 35 for Cleveland trying to stay close Green wins the tip
40:06,2405.85,5.12,Barbossa had a 14-point game in Game six
40:11,2410.97,6.10,as helped here off the bench curry from way down town Richard Jefferson tracks
40:17,2417.07,5.78,it down [Applause]
40:24,2424.12,5.94,that's going to be the third foul on Steph Curry
40:32,2431.73,13.32,seekers not going to take any chances with 109 remaining [Applause]
40:45,2445.05,6.72,I thought he had good legal guarding position when Shumpert ran into him both
40:52,2451.77,5.61,Larry and her were fined by the NBA 25 grand after complaints about officiating
40:57,2457.38,4.31,in Game six when curry fouled out
41:04,2464.29,5.19,if it looked like shuffle initiated the contact as mote waves comes in and curry
41:09,2469.48,5.52,will sit down but either way I agree
41:15,2475.00,5.55,with the decision by speaker to take Steph Curry out of the ballgame three fouls with a little over a minute to go
41:21,2480.55,9.54,in this half you do not want him to pick up his fourth Livingston comes in on the anti ref chant in full throat fives tyloo I'd
41:30,2490.09,5.96,also be thinking about Kevin Love more right now I know this is a tough lineup
41:36,2496.05,7.38,but he gives you a weapon on offense because he gives you second-chance opportunities
41:48,2508.34,5.52,model minute here the first and biggest Allah little post up holes need without
41:54,2513.86,6.21,upset telling klay Thompson get out of the way when I have the smaller Kyrie Irving on me get out of my way and allow
42:00,2520.07,7.50,me to work his first field goal good
42:08,2527.57,6.00,ball denial from the Warriors Jefferson back up top Livingston picks up James
42:14,2533.57,8.27,with six to shoot James pulls back the contested three too strong at the dala this fourth rebound
42:36,2555.70,7.05,five on the 24 Livingston tied up down to two Livingston the pull-up jumper and
42:43,2562.75,5.10,Jefferson the rebound final seconds James throws it head knocked away picked
42:48,2567.85,5.15,up ball loose on the first half comes to an end
42:53,2573.00,7.36,draymond Green sensational with 22 points 5 of 5 from three-point range six
43:00,2580.36,6.66,rebounds and five assists LeBron James a strong first half with 12
43:07,2587.02,8.31,8 and 5 but Cleveland just 1 of 14 from downtown while Golden State is 10 for 21
43:15,2595.33,5.58,it's the first two games here at Oracle they struggled to get to 40% shooting
43:21,2600.91,7.17,but they had seemed to find a great rhythm the past couple of games as we check in with DB Doris Mike guy as tyloo
43:28,2608.08,5.40,about the 10 threes given up specifically the five by draymond Green he said listen those of the guys were
43:33,2613.48,5.37,going to concede them too it would be dream on but we can't give him full dare shops we've got to be closer and have a
43:39,2618.85,7.02,hand up I asked him about why he went away from Tristan Thompson and Kevin Love he said they both got a couple of fouls he said
43:46,2625.87,6.84,I didn't want them picking up the 3rd have changed the equation here in the second half on the offensive end he said too many turnovers too many lazy passes
43:53,2632.71,5.19,Mike Ozzie Lee gets inside Thank You Doris well defended by Thompson Festus
43:58,2637.90,5.04,Ezeli who started the game his first start of the playoffs and played six
44:03,2642.94,5.97,minutes JR Smith will hand that his face nails that 2 pointer oh my god
44:09,2648.91,5.61,understand what tyloo told Doris if I'm over there I'm
44:15,2654.52,5.07,not going down with Mo Williams in Devon shuffled with all due respect Tristan Thompson has played outstanding
44:20,2659.59,6.66,they need his presence before being a nosy li with the foul as draymond Green little heat check there
44:26,2666.25,7.77,from well beyond the arc misses his first three-pointer of the night but I concur with what Mark said love has
44:34,2674.02,5.85,started off great Thompson has been an integral part of your rebounding
44:40,2679.87,6.90,advantage listen you got to go down with these guys Thompson nice soft touch that
44:47,2686.77,7.73,time using the left hand and Tristan Thompson his second field goal it's quickly back to three
44:56,2695.99,8.04,another three-pointer 11 now for Golden State play Thompson with his second you
45:04,2704.03,5.13,got to be committed defense that's good offense that's what the Warriors have been doing all year long got to keep a
45:09,2709.16,5.83,body on the old guy Irving shake and bake his shot misses draymond Green this seventh rebound
45:15,2714.99,6.38,[Applause] Thompson trying to get away from Kevin
45:21,2721.37,5.58,Love stops pulls up rattles home klay
45:27,2726.95,6.93,Thompson was 2 for 9 in the first half but he had some quality looks and this
45:34,2733.88,6.86,the largest lead of the night so far [Applause]
45:41,2740.74,6.19,game on green playing back well off LeBron James hurry with the 3,000 some
45:47,2746.93,7.35,up Jr sit tries another three that's good JR Smith with a couple of buckets here to begin the third of your warriors
45:54,2754.28,6.30,you can't overreact that's good defense forced them to make a tough shot just their second three-pointer of the game
46:01,2760.58,5.75,Barnes jumper as he Lee banks it off the backboard and love comes up with it
46:06,2766.33,5.89,here's Irving and a foul called Barnes
46:12,2772.22,6.36,his second but they've been so successful in putting Steph Curry in a pick and roll they switched
46:19,2778.58,6.90,communication poor that's a good contest getting back into the pitcher just a big time shot by Smith Jairus mythus had
46:25,2785.48,6.15,some good first half's but he's been quiet in many of the second half's good start here in the third for the
46:32,2791.63,6.90,Cavaliers from Smith curry with the three fouls James passes it off Smith another three
46:39,2798.53,5.43,that's good JR Smith back-to-back threes and eight points here to start the third
46:44,2803.96,5.73,quarter but great flare screen set by Kyrie Irving to help him to get just
46:50,2809.69,6.26,enough space for that jumper stream on green
46:57,2817.25,7.05,Thompson back to green deflected ball knocked loose picked up by Thompson and a turnover
47:07,2827.24,5.20,two-point lead for Golden State three minutes gone by here in the third here's
47:12,2832.44,9.26,what you can't have Festus Ezeli defending Kyrie Irving Irving drives and finishes and a quick
47:22,2841.70,5.52,timeout from Steve firm after Golden State had opened up their largest lead
47:27,2847.22,6.36,the Cavaliers rattle off eight straight as a recipe for disaster you got to get back and then communicate defend your
47:34,2853.58,6.21,man you can't have a Senate in as Ely defending Kyrie Irving who's he's too skilled for gods he's gonna get this
47:40,2859.79,6.16,spot and the beautiful finish with the left hand [Music]
47:46,2865.95,6.39,all tied up Game seven of the finals as jr. Smith has come alive eight of his 12
47:52,2872.34,5.40,here in the first three plus minutes of a third quarter
47:59,2878.73,5.25,niggath Allison as is Anderson Varejao
48:04,2883.98,6.72,palcohol is going to go against Cleveland LA to contact as they were fighting through screens
48:12,2892.09,5.53,Jr Smith is third it's a tough play Josh
48:18,2897.62,5.45,Smith putting the body in the Steph Curry clearly contact
48:30,2910.18,7.15,Kyrie Irving we talked about his outfits he's done a very solid job whole series when guarding Steph Curry Thompson gets
48:37,2917.33,5.49,away and mrs. Irving the long rebound three on one Smith frozen up blocked by
48:43,2922.82,5.75,curry that comes curry the other way two on one curry the drive and the finish
48:49,2928.57,5.44,what a sensational defensive play and the hustle get back to break up the
48:54,2934.01,6.78,alley-oop huge play by Steph Curry that's a big swing got a dump full LeBron James forces the turnover and
49:01,2940.79,6.75,then in transition fish Smith drives poked away again by curry curry throws
49:08,2947.54,10.11,it ahead to Thompson Thompson pass deflected and picked up by Irving good hands from LeBron James James hangs on
49:18,2957.65,5.07,to that pivot foot and his jump shot is off loose ball foul is going to go
49:23,2962.72,6.28,against Tristan Thompson and that's his third [Applause]
49:29,2969.00,7.74,just great awareness from curry we saw highlights with John Smith made this play in the previous game active hands
49:37,2976.74,6.18,comes up with the deflection and then attacks the body of Kevin Love don't messing around eliminates his ability to
49:43,2982.92,9.08,block the shot curry off the curl pets afraid timeout Cleveland
50:01,3001.09,8.32,the ability to work off of screens get balanced and raise up from behind the
50:09,3009.41,7.64,three an absolute thing of beauty courage gives the Warriors a five-point
50:17,3017.05,6.66,lead Steph Curry now with 14 points and four rebounds he's five of 10 from the
50:24,3023.71,8.16,field the cavaliers overall have done a tremendous job on curry during his finals as curry tries to knock it away
50:32,3031.87,6.11,from James but curry with some fine defensive plays here in the third quarter
50:38,3037.98,5.65,curry tries to deny James gets it shot clock winding down in to love and love
50:44,3043.63,5.37,lays it in as the shot clock expires 9
50:49,3049.00,12.79,assists now for LeBron James [Applause]
51:02,3061.79,6.72,marichal off to Koreans draymond green inside Varejao knocked out of his hands
51:09,3068.51,6.72,he thought he was hit here comes James the other way James spins drives and
51:15,3075.23,9.14,hammered as he goes to the basket he'll shoot two Andy Varejao still complaining
51:24,3084.37,6.88,it's a beautiful look by draymond Green and looks like a very nice play by Kyrie
51:31,3091.25,6.64,Irving to pop the ball loose [Applause]
51:39,3098.70,5.99, dollar his second foul on the rate of part of game sevens and
51:45,3104.69,6.81,playoffs in general is the coaches ability to read and react I thought that was an outstanding timeout fight I loo
51:52,3111.50,6.24,all the momentum going towards the Warriors Steph Curry establishing a rhythm making plays the crowd going
51:58,3117.74,7.44,crazy he stops the momentum and gives his team a chance to regroup James it's
52:05,3125.18,5.49,a pair we've already had 13 lead change in this
52:11,3130.67,6.63,game and a final series that has not had very many close games really none going
52:17,3137.30,6.12,down to the wire here comes curry inside Varejao stolen by love Irving goes at
52:23,3143.42,5.07,draymond Green drives layup it's good beautiful move from Kyrie Irving and
52:28,3148.49,6.30,Cleveland regains the lead such a great finisher in the open court can go off
52:35,3154.79,4.52,either foot and finish with either hands
52:41,3161.28,6.57,Thompson inside broken up by JR Smith and it's still Golden State ball they'll
52:48,3167.85,9.02,have seven to shoot I mean this is just a thing of beauty wrong-footed just
52:57,3176.87,6.78,exquisite in the open floor 13 points for Kyrie Irving 7 on the 24
53:04,3183.65,6.40,JR Smith right up on top of klay Thompson niggath Allen has to put it up
53:10,3190.05,5.34,just gets it off in time and barely grazes the rim Kevin Love meanwhile with
53:15,3195.39,6.57,his 11th rebound of the game and I'm Kyrie Irving I'm thinking attack Steph Curry right now dribbles it off the foot
53:22,3201.96,6.57,was it off Curry's foot or Irving myname a kitchen staying off of Murray's foot
53:29,3208.53,3.98,long a kickball I believe Mike
53:37,3217.32,6.39,it should be Cleveland ball was off Curry's foot unless it touch that back heel of Irving is that when Patty's call
53:44,3223.71,8.76,and he kept the call to kick ball though so it stopped before it went out of bounds James jump shot take it away by
53:52,3232.47,6.27,Irving the following missed it Kevin Love has it knocked out of his hands and a loose ball is going to go against
53:59,3238.74,5.37,Golden State and right now the Warriors
54:04,3244.11,6.34,have got to begin to chase down loose basketballs too many 5050 balls are going the way of the Cavs
54:10,3250.45,5.97,[Applause]
54:16,3256.42,6.24,and LeBron James has yet to make a jump shot from any range last couple of games
54:23,3262.66,9.27,his jump shot has been huge for him Junior Smith steps back misses rebound knocked loose and it's warriors ball but
54:32,3271.93,5.40,that's a shot they're gonna be able to get the way the Warriors are defending with Steph Curry showing Terrell Smith
54:37,3277.33,6.77,got to be ready to take and make those house and not be afraid to put it on the ground either
54:47,3286.72,6.66,are we looking for a screen marichal sets that gets a good look from three draymond Green trying to get it knocked
54:53,3293.38,6.12,out of bounds last touched by Irving Cavaliers arguing but it's called Golden
54:60,3299.50,7.49,State ball they got away because this was bad defense for good job by draymond Green getting back into the pitcher
55:07,3306.99,10.06,tough to tell but the Warriors have the basketball in English klay Thompson
55:17,3317.05,6.95,catches fires too strong rebound James [Applause]
55:24,3324.00,6.55,eight rebounds for LeBron James Irving the crossover gets into the paint running shot blocked with a foul
55:31,3330.55,5.40,Thompson blocked it with Varejao call for the block and free throws for Kyrie
55:36,3335.95,6.78,Irving coach what we've seen in the past a steady diet of high pick and rolls with the five man for the Warriors
55:43,3342.73,4.28,allowing these permit of guys to go downhill
55:48,3347.79,6.34,Varejao is third foul and that's a good call as Irving's going in his upward
55:54,3354.13,7.13,motion Varejao is not yet set in legal guarding position
56:13,3372.70,10.93,[Applause]
56:24,3383.63,5.88,loves bumps curry curry pass deflected and stolen here comes Irving Irving
56:30,3389.51,6.66,drives pass green the pow Schatz bud and one go on a sweet move from Kyrie Irving
56:36,3396.17,6.35,and the Cavaliers with their largest lead of the night [Applause]
56:43,3402.52,6.34,Kayla's basketball my Korean to pick a road good job by Kevin Love and then the active hands to come up with eternal and
56:49,3408.86,6.63,uncle drew putting on a clinic in this third quarter takes the contact how about the beautiful finish with the left
56:55,3415.49,8.96,hand my goodness spectacular eight of his 17 points here in this third period
57:05,3424.60,6.46,Green picks up his first foul since that time out you spoke of mark ten straight
57:11,3431.06,6.72,points by Cleveland I'm jealous that left-handed shot in 17 years playing in the league I took one left-handed shot it was a
57:18,3437.78,5.16,dare from a coach by the name of Jeff Van Gundy did you make that one yes I
57:23,3442.94,6.57,did yes you did Faton a thousand lefty on 11 all run the Cavaliers with a
57:30,3449.51,6.99,six-point advantage it's been a 14-point turnaround here on the third Golden State led by as many as eight now it's
57:37,3456.50,6.29,65 fifty-nine and Kyrie Irving sending the fans back in Cleveland
57:43,3462.96,6.93,into a French's [Music]
57:50,3469.89,5.50,platelet sports fans have waited a long time since Jim Brown and the Cleveland
57:55,3475.39,6.72,Browns defeated the Colts December 27th 1964 and the Cavaliers in their forty
58:02,3482.11,6.18,five seasons in the NBA still looking for their first title with 433 remaining
58:08,3488.29,5.10,third quarter of Game seven of the NBA Finals they have a six-point lead and
58:13,3493.39,6.93,guys we talked about this the other night the Warriors again the highest scoring team in the NBA in the past 24
58:20,3500.32,5.43,years yet once again they're shooting 39% is that the Cavaliers strategy is it
58:26,3505.75,6.77,the personnel wive they're so effective and making it difficult to scores Barnes gets inside
58:33,3512.69,6.39,that's good execution out of the timeout but to me you've got to be disciplined against the Warriors defense Lee to give
58:39,3519.08,5.73,yourselves a chance they've been taken and making tough shots all season long Mike and they've gone through a drought
58:45,3524.81,7.35,but you also have to give credit to the Cleveland Cavaliers defense I was born second field goal Kyrie Irving knocks
58:52,3532.16,5.64,down a three Irving having a huge third quarter 12 of
58:58,3537.80,10.86,his 21 that's his first three-pointer and a lead is up to 7 [Applause]
59:09,3548.66,6.51,Tristan Thompson is on Steph Curry Barnes guarded by Irving gets inside and
59:15,3555.17,5.40,his foul free-throw disparity is pretty big 16 attempts for Cleveland only four
59:21,3560.57,8.04,for Golden State again the crossover the screen gets some
59:29,3568.61,5.43,space raises up knocks it in but it shows you the difference if Steph
